<?xml version="1.0" encoding="UTF-8"?>
<Response xmlns:xsi="http://www.w3.org/2001/XMLSchema-instance" xsi:noNamespaceSchemaLocation="PlanProjectResponse.xsd">
    <PlanProject>
        <NumberPlanProject>1</NumberPlanProject>
        <DatePlanProject>2025-01-01</DatePlanProject>
        <Other>Имются утвержденные изменения</Other>
        <ObjectNamePlanProject>Объект</ObjectNamePlanProject>
        <AmmendInfo>Постановление от 01.10.2025 № 63</AmmendInfo>
    </PlanProject>
    <Attachments>
        <Attachment>
            <IsUnstructuredFогmаt>false</IsUnstructuredFогmаt>
            <IsZipPacked>true</IsZipPacked>
            <ZipName>Архив</ZipName>
            <FileName>Чертеж планировки территории</FileName>
            <FileMimeType>image/pdf</FileMimeType>
        </Attachment>
        <Attachment>
            <IsUnstructuredFогmаt>false</IsUnstructuredFогmаt>
            <IsZipPacked>true</IsZipPacked>
            <ZipName>Архив</ZipName>
            <FileName>Положение о характеристиках планируемого развития территории</FileName>
            <FileMimeType>text/doc</FileMimeType>
        </Attachment>
    </Attachments>
</Response>